{
  "$schema": "https://json-schema.org/draft/2020-12/schema",
  "$id": "https://agentic-automl.local/benchmark/poison-variant.schema.json",
  "title": "PoisonVariantManifest",
  "type": "object",
  "additionalProperties": false,
  "required": [
    "schemaVersion",
    "variantId",
    "baseDatasetRef",
    "issueFamily",
    "seed",
    "patches",
    "scoringContract"
  ],
  "properties": {
    "schemaVersion": { "const": 1 },
    "variantId": { "type": "string", "minLength": 1 },
    "baseDatasetRef": { "type": "string", "minLength": 1 },
    "issueFamily": { "type": "string", "minLength": 1 },
    "seed": { "type": "integer" },
    "patches": {
      "type": "array",
      "minItems": 1,
      "items": { "type": "object" }
    },
    "scoringContract": { "type": "object" }
  }
}
